{
  "schema": "provenancecode.spec.v2",
  "spec_id": "SPEC-PROV-CORE-000001",
  "title": "ProvenanceCode governance bundle v1 implementation",
  "status": "approved",
  "risk": "medium",
  "acceptance_criteria": [
    "Copilot post-tool and agent-stop hooks call prvc deterministically",
    "Cursor hooks call prvc deterministically",
    "PR check fails when meaningful changes are missing GEN artifacts",
    "PR check fails when risk-triggered changes are missing DEC artifacts"
  ],
  "affected_paths": [
    ".github/hooks/**",
    ".github/workflows/provenance-governance-gate.yml",
    ".provenance/**",
    ".cursor/hooks/**",
    ".cursor/rules/**"
  ],
  "related_decisions": [
    "DEC-PROV-CORE-000001"
  ],
  "timestamps": {
    "created_at": "2026-02-18T00:00:00Z",
    "updated_at": "2026-02-18T00:00:00Z"
  }
}
